{
  "schema_version": "lab.target_capability_profile.v1",
  "target_id": "raspberry_pi_5_reference_pending",
  "workload_id": "bounded_cpu_load_2_workers_60s",
  "evidence_pack_ref": null,
  "capability_status": "insufficient_for_selection",
  "selection_ready": false,
  "observed_results": {
    "max_temp_c": null,
    "abort_count": 0,
    "cpu_frequency_range_khz": null,
    "memory_available_kb_min": null,
    "max_load_duration_ms": 0,
    "max_observation_duration_ms": 0,
    "load_result_count": 0,
    "observation_sample_count": 0
  },
  "supported_claims": [],
  "blocked_claims": [
    "Pi4 is sufficient for this workload",
    "Pi5 is required for this workload",
    "battery safe",
    "sustained production ready",
    "all operating points measured",
    "fixed-frequency behavior verified",
    "low overhead under all operating points"
  ],
  "next_evidence_needed": [
    "Pi5 same-suite read-only familiarization run",
    "Pi5 bounded workload result artifact",
    "Pi4/Pi5 same-suite target comparison",
    "30 minute sustained thermal run",
    "controlled operating point sweep",
    "latency/jitter measurement",
    "battery/power and storage/write evidence"
  ],
  "evidence_refs": [],
  "time_unix_ms": 1780000000000
}
