{
  "schema_version": "lab.target_capability_profile.v1",
  "target_id": "raspberry_pi_4_target55",
  "workload_id": "bounded_cpu_load_2_workers_60s",
  "evidence_pack_ref": "artifact://lab/runs/LAB-RUN-target55-load-observer-off/run_manifest.json",
  "capability_status": "exploratory_partial",
  "selection_ready": false,
  "observed_results": {
    "max_temp_c": 54.53,
    "abort_count": 0,
    "cpu_frequency_range_khz": [1800000, 1800000],
    "memory_available_kb_min": null,
    "max_load_duration_ms": 10000,
    "max_observation_duration_ms": 10000,
    "load_result_count": 2,
    "observation_sample_count": 10
  },
  "supported_claims": [
    "target completed shorter bounded 2-worker CPU short-smoke artifact(s) without recorded abort",
    "target produced passive observation samples under the current target policy"
  ],
  "blocked_claims": [
    "Pi4 is sufficient for this workload",
    "Pi5 is required for this workload",
    "battery safe",
    "sustained production ready",
    "all operating points measured",
    "fixed-frequency behavior verified",
    "low overhead under all operating points"
  ],
  "next_evidence_needed": [
    "Pi4/Pi5 same-suite target comparison",
    "60 second bounded workload run for this exact workload profile",
    "30 minute sustained thermal run",
    "controlled operating point sweep",
    "latency/jitter measurement",
    "battery/power and storage/write evidence"
  ],
  "evidence_refs": [
    "artifact://lab/runs/LAB-RUN-target55-load-observer-off/loads/LOAD-1edfd5ff-ce11-4f6c-bc14-3b56ecc0b1b6.result.json",
    "artifact://lab/runs/LAB-RUN-target55-observer-on-load/loads/LOAD-bbf31000-0b28-4f38-8350-20a4269dd9ad.result.json",
    "artifact://lab/runs/LAB-RUN-target55-observer-on-observe/observations/observe.json"
  ],
  "time_unix_ms": 1780000000000
}
