{
  "schema_version": "lab.target_capability_profile.v1",
  "target_id": "raspberry_pi_4_target55",
  "workload_id": "bounded_cpu_load_2_workers_60s",
  "evidence_pack_ref": "artifact://lab/runs/LAB-RUN-001/run_manifest.json",
  "capability_status": "measured_short_smoke",
  "selection_ready": false,
  "observed_results": {
    "max_temp_c": 54.5,
    "abort_count": 0,
    "cpu_frequency_range_khz": [600000, 1800000],
    "memory_available_kb_min": 7332200,
    "max_load_duration_ms": 60000,
    "max_observation_duration_ms": 60000,
    "load_result_count": 1,
    "observation_sample_count": 10
  },
  "supported_claims": [
    "target completed bounded workload short-smoke artifact(s) without recorded abort"
  ],
  "blocked_claims": [
    "Pi4 is sufficient for this workload",
    "Pi5 is required for this workload",
    "battery safe",
    "sustained production ready",
    "all operating points measured"
  ],
  "next_evidence_needed": [
    "Pi4/Pi5 same-suite target comparison",
    "30 minute sustained thermal run",
    "controlled operating point sweep"
  ],
  "evidence_refs": [
    "artifact://lab/runs/LAB-RUN-001/run_manifest.json",
    "artifact://lab/runs/LAB-RUN-001/loads/LOAD-001.result.json"
  ],
  "time_unix_ms": 1780000000000
}
